{
  "$schema": "http://json-schema.org/draft-07/schema#",
  "title": "Kosh Performance Report",
  "description": "Schema for the kosh performance report: LCP, CLS, load timings, console errors and failed network requests across several pages of a WordPress site, at desktop and mobile viewports. The measurements in pages[] come from the browser's page capture, not from the model. Renders through the standard QA renderer in scripts/generate-report.js.",
  "type": "object",
  "required": ["url", "websiteName", "timestamp", "environment", "visitedPages", "pages", "issues"],
  "additionalProperties": false,
  "properties": {
    "url": {
      "$ref": "#/definitions/webUrl",
      "description": "The homepage URL the test started from."
    },
    "websiteName": {
      "type": "string",
      "description": "Site name from og:site_name, the WordPress site title, or the page title."
    },
    "timestamp": {
      "type": "string",
      "format": "date-time",
      "description": "ISO 8601 timestamp of when the test was run."
    },
    "provenance": {
      "type": "object",
      "description": "What produced this report, so runs can be compared across plugin versions, skill edits, and models.",
      "properties": {
        "model": {
          "type": "string",
          "description": "Exact model ID the run was served by. For a skill's own output on Claude Code, read from the session log by scripts/run-qa-report.sh; elsewhere self-reported by the model, \"unknown\" when its system prompt does not state one. The only provenance field the skill writes."
        },
        "modelSource": {
          "type": "string",
          "enum": ["transcript", "self-report"],
          "description": "Where model came from: \"transcript\" is Claude Code's session log (the model that served the run's latest reply), \"self-report\" is the skill's own claim, used when there is no session log and when the report is re-rendered. Added by scripts/run-qa-report.sh — do not write this field."
        },
        "effort": {
          "type": "string",
          "minLength": 1,
          "description": "The reasoning effort the run's latest reply was sent at, from Claude Code's session log or its CLAUDE_EFFORT variable; absent on hosts that set neither. Added by scripts/run-qa-report.sh — do not write this field."
        },
        "pluginVersion": {
          "type": "string",
          "description": "kosh version from .claude-plugin/plugin.json. Added by scripts/run-qa-report.sh — do not write this field."
        },
        "skills": {
          "type": "object",
          "additionalProperties": { "type": "string", "pattern": "^[0-9a-f]{64}$" },
          "description": "SHA-256 of each skill directory that produced the report, keyed by skill name. Added by scripts/run-qa-report.sh — do not write this field."
        },
        "collectors": {
          "type": "string",
          "pattern": "^[0-9a-f]{64}$",
          "description": "SHA-256 of the collectors/ directory, the page-side code Playwright MCP loads into every page, as it was on disk when the report was rendered. A session started before collectors/ changed ran the older code. Added by scripts/run-qa-report.sh — do not write this field."
        },
        "playwrightMcp": {
          "type": "array",
          "items": { "type": "string" },
          "description": "The Playwright MCP arguments (the pinned version and its flags) in kosh's plugin.json when the report was rendered. A session started before plugin.json changed ran with the older ones. Added by scripts/run-qa-report.sh — do not write this field."
        },
        "captureSha256": {
          "type": "string",
          "pattern": "^[0-9a-f]{64}$",
          "description": "SHA-256 of the page capture archived beside the report as <name>.capture.jsonl, which a performance report's pages[] are built from. Added by scripts/run-qa-report.sh — do not write this field."
        },
        "heldTo": {
          "type": "string",
          "minLength": 1,
          "description": "The host the run's browser was held to once the gate check came back clear, from the page capture: after that, a page on another host or the model's own request to one was refused. Added by scripts/run-qa-report.sh — do not write this field."
        },
        "seal": {
          "type": "string",
          "pattern": "^[0-9a-f]{64}$",
          "description": "SHA-256 over the report timestamp, pluginVersion, skills, collectors, playwrightMcp, captureSha256, model, modelSource, effort and heldTo, marking the block as script-stamped for this run. Added by scripts/run-qa-report.sh — do not write this field."
        }
      }
    },
    "environment": {
      "type": "string",
      "enum": ["local", "development", "staging", "production"],
      "description": "Environment the site was running in during the test. Defaults to production."
    },
    "testMethodology": {
      "type": "string",
      "description": "Short prose description of how the test was performed: pages and viewports, how timings were taken, and anything that affects how the numbers compare, such as a warm browser cache."
    },
    "visitedPages": {
      "type": "array",
      "minItems": 1,
      "items": { "$ref": "#/definitions/webUrl" },
      "description": "URLs of every page the test covered. Each must have a captured visit in pages[], or the report is refused."
    },
    "pages": {
      "type": "array",
      "items": { "$ref": "#/definitions/pageResult" },
      "description": "One row per page and viewport the browser loaded on the report's host, built from the page capture. Added by scripts/run-qa-report.sh — do not write this field."
    },
    "explorationPass": {
      "type": "array",
      "description": "Threads investigated beyond the checks, recorded whatever the outcome, so an observation outside this test's scope survives here instead of becoming a finding. Findings themselves live in `issues`.",
      "items": {
        "type": "object",
        "required": ["check", "outcome", "detail"],
        "additionalProperties": false,
        "properties": {
          "check": { "type": "string", "description": "What was examined, specific enough for someone else to repeat it." },
          "outcome": {
            "type": "string",
            "enum": ["no-issue", "finding-raised", "inconclusive", "out-of-scope"],
            "description": "no-issue = investigated and fine. finding-raised = became an entry in `issues`. inconclusive = cannot be settled without access not available during the run. out-of-scope = a real problem outside performance, in which case set `referredTo`."
          },
          "detail": { "type": "string", "description": "What was actually observed, including the evidence. For inconclusive outcomes, say what would settle it. For finding-raised, name the finding." },
          "area": { "type": "string", "description": "Surface this relates to, e.g. Images, Fonts, Scripts. Free text." },
          "referredTo": { "type": "string", "description": "For out-of-scope outcomes, the kosh test that covers this territory, e.g. a11y or functional-design." }
        }
      }
    },
    "issues": {
      "type": "object",
      "description": "Findings grouped by severity.",
      "required": ["critical", "high", "medium", "low"],
      "additionalProperties": false,
      "properties": {
        "critical": {
          "type": "array",
          "items": { "$ref": "#/definitions/finding" },
          "description": "Site-breaking."
        },
        "high": {
          "type": "array",
          "items": { "$ref": "#/definitions/finding" },
          "description": "Significant user impact."
        },
        "medium": {
          "type": "array",
          "items": { "$ref": "#/definitions/finding" },
          "description": "Noticeable but not blocking."
        },
        "low": {
          "type": "array",
          "items": { "$ref": "#/definitions/finding" },
          "description": "Minor."
        }
      }
    }
  },
  "definitions": {
    "webUrl": {
      "type": "string",
      "format": "uri",
      "pattern": "^https?://",
      "description": "An http(s) URL of a page kosh navigated to. URLs observed on the site, such as a failed request's, are plain strings: a malformed one is something to report, not to fix in the JSON."
    },
    "pageResult": {
      "type": "object",
      "required": ["url", "redirectedFrom", "viewport", "status", "visits", "loadTime", "domContentLoaded", "ttfb", "transferSize", "resourceTransferSize", "lcp", "cls", "vitalsSettled", "console", "network"],
      "additionalProperties": false,
      "properties": {
        "url": { "$ref": "#/definitions/webUrl", "description": "The page's URL after any redirects." },
        "redirectedFrom": { "type": "array", "items": { "type": "string" }, "description": "URLs that redirected to this one, as observed." },
        "viewport": { "type": ["string", "null"], "pattern": "^\\d+x\\d+$", "description": "WIDTHxHEIGHT as the page saw it; null when no timing was read." },
        "status": { "type": ["integer", "null"], "description": "HTTP status of the document; null when it got no response." },
        "failure": { "type": "string", "description": "Why the document failed to load, e.g. net::ERR_NAME_NOT_RESOLVED." },
        "visits": { "type": "integer", "minimum": 1, "description": "Loads of this page at this viewport. Only the first is measured, since a revisit loads from a warm cache." },
        "loadTime": { "type": ["number", "null"], "description": "loadEventEnd in milliseconds; null when not measured." },
        "domContentLoaded": { "type": ["number", "null"], "description": "domContentLoadedEventEnd in milliseconds." },
        "ttfb": { "type": ["number", "null"], "description": "responseStart in milliseconds." },
        "transferSize": { "type": ["number", "null"], "description": "Bytes transferred for the document." },
        "resourceTransferSize": { "type": ["number", "null"], "description": "Bytes transferred for subresources by the time of the load event; near zero on a warm cache." },
        "timingError": { "type": "string", "description": "Why no timing was recorded." },
        "loggedIn": { "const": true, "description": "Present when the page loaded for a logged-in WordPress user (its `logged-in` body class), so it also loaded the admin bar and logged-in tools a visitor doesn't." },
        "lcp": { "type": ["number", "null"], "description": "Largest Contentful Paint in milliseconds, one lab load; null when the page reported none." },
        "cls": { "type": ["number", "null"], "description": "Cumulative Layout Shift over the visit, up to 10 s after load, one lab load." },
        "vitalsSettled": { "type": ["boolean", "null"], "description": "false when a new LCP candidate or layout shift arrived in the last second before the read ended, or when Chrome's buffer of 150 layout shifts filled, which makes `cls` a lower bound; null when not read." },
        "console": {
          "type": "array",
          "items": {
            "type": "object",
            "required": ["level", "text"],
            "additionalProperties": false,
            "properties": {
              "level": { "type": "string", "description": "error, warning, or pageerror for an uncaught exception." },
              "text": { "type": "string", "description": "The message text, clipped." },
              "source": { "type": "string", "description": "The script URL that logged it." }
            }
          },
          "description": "Console errors and warnings, and uncaught exceptions, from every visit to this page at this viewport."
        },
        "network": {
          "type": "array",
          "items": {
            "type": "object",
            "required": ["url", "status", "resourceType"],
            "additionalProperties": false,
            "properties": {
              "url": { "type": "string", "description": "The requested URL, as observed." },
              "status": { "type": ["integer", "null"], "description": "HTTP status; null for a request that got no response, such as blocked mixed content." },
              "failure": { "type": "string", "description": "The browser's reason for a request that got no response." },
              "resourceType": { "type": "string", "description": "Resource type, e.g. script, stylesheet, image, font." }
            }
          },
          "description": "Failed subresource requests only: status 400 and up, or no response."
        },
        "truncated": { "type": "boolean", "description": "true when a visit stopped recording rows at its limit." }
      }
    },
    "finding": {
      "type": "object",
      "required": ["category", "issue", "impact", "device", "pages"],
      "additionalProperties": false,
      "properties": {
        "category": {
          "type": "string",
          "enum": ["Performance", "JavaScript", "Network", "MixedContent", "ServerError"],
          "description": "Performance = LCP or CLS outside the good band. JavaScript = console errors from JS failures. Network = failed resource requests. MixedContent = HTTP resources on HTTPS pages. ServerError = 5xx server-side failures."
        },
        "issue": {
          "type": "string",
          "description": "What is wrong, naming the specific resource, page or behavior."
        },
        "impact": {
          "type": "string",
          "description": "How this affects users."
        },
        "device": {
          "type": "string",
          "enum": ["mobile", "desktop", "both"],
          "description": "Which viewport the issue was observed on."
        },
        "pages": {
          "type": "array",
          "minItems": 1,
          "items": { "$ref": "#/definitions/webUrl" },
          "description": "URLs where the issue was observed."
        },
        "metric": {
          "type": "string",
          "description": "The measurement behind the finding, e.g. 'Load time 3.4s (target < 3s)'."
        },
        "screenshots": {
          "type": "array",
          "items": {
            "type": "string",
            "pattern": "^screenshots/"
          },
          "description": "Paths relative to the kosh-reports/ directory, e.g. 'screenshots/homepage-network-tab.png' for a file saved at kosh-reports/screenshots/homepage-network-tab.png."
        }
      }
    }
  }
}
