{
  "url": "https://example.com/",
  "websiteName": "Example Site",
  "timestamp": "2026-10-13T16:58:51Z",
  "provenance": {
    "model": "claude-opus-5-5[1m]",
    "pluginVersion": "1.3.0",
    "skills": {
      "performance": "61a863adbe24a8aab3af2c62fcb2b535da212a5cf989f078f0fb076a017cfd51"
    },
    "collectors": "23cd057b553962592b3b02e561730426b907e7e517617a0871b86a10bd276a86",
    "playwrightMcp": [
      "@playwright/mcp@0.0.82",
      "--isolated",
      "--no-webmcp",
      "--init-script",
      "collectors/kosh.js",
      "--init-page",
      "collectors/capture.js"
    ],
    "seal": "217b8dde85cf8dadec61d6c5206c38caa082beb3740faa70a77de487faa4df72",
    "captureSha256": "66984e048949921e62582c16d7e60f88ea3759d825b17a2ab0d71f047955c655"
  },
  "environment": "development",
  "testMethodology": "Redacted text.",
  "visitedPages": [
    "https://example.com/",
    "https://example.com/videos/",
    "https://example.com/video/sample-video-one/",
    "https://example.com/donate/",
    "https://example.com/video/sample-video-two/",
    "https://example.com/videos/page/2/"
  ],
  "issues": {
    "critical": [],
    "high": [],
    "medium": [],
    "low": []
  },
  "pages": [
    {
      "url": "https://example.com/",
      "redirectedFrom": [],
      "viewport": "1920x1080",
      "status": 200,
      "visits": 1,
      "loadTime": 1027,
      "domContentLoaded": 790,
      "ttfb": 171,
      "transferSize": 41326,
      "resourceTransferSize": 667167,
      "lcp": null,
      "cls": null,
      "vitalsSettled": null,
      "console": [],
      "network": []
    },
    {
      "url": "https://example.com/videos/",
      "redirectedFrom": [],
      "viewport": "1920x1080",
      "status": 200,
      "visits": 1,
      "loadTime": 1980,
      "domContentLoaded": 1715,
      "ttfb": 1657,
      "transferSize": 27665,
      "resourceTransferSize": 132850,
      "lcp": null,
      "cls": null,
      "vitalsSettled": null,
      "console": [],
      "network": []
    },
    {
      "url": "https://example.com/video/sample-video-one/",
      "redirectedFrom": [],
      "viewport": "1920x1080",
      "status": 200,
      "visits": 2,
      "loadTime": 2600,
      "domContentLoaded": 1749,
      "ttfb": 1705,
      "transferSize": 27033,
      "resourceTransferSize": 722,
      "lcp": null,
      "cls": null,
      "vitalsSettled": null,
      "console": [],
      "network": []
    },
    {
      "url": "https://example.com/donate/",
      "redirectedFrom": [],
      "viewport": "1920x1080",
      "status": 200,
      "visits": 1,
      "loadTime": 1769,
      "domContentLoaded": 1523,
      "ttfb": 1486,
      "transferSize": 26607,
      "resourceTransferSize": 18940,
      "lcp": null,
      "cls": null,
      "vitalsSettled": null,
      "console": [],
      "network": []
    },
    {
      "url": "https://example.com/video/sample-video-two/",
      "redirectedFrom": [],
      "viewport": "1920x1080",
      "status": 200,
      "visits": 1,
      "loadTime": 1819,
      "domContentLoaded": 1509,
      "ttfb": 1466,
      "transferSize": 27137,
      "resourceTransferSize": 57702,
      "lcp": null,
      "cls": null,
      "vitalsSettled": null,
      "console": [],
      "network": []
    },
    {
      "url": "https://example.com/videos/page/2/",
      "redirectedFrom": [],
      "viewport": "1920x1080",
      "status": 200,
      "visits": 2,
      "loadTime": 2544,
      "domContentLoaded": 1728,
      "ttfb": 1678,
      "transferSize": 27246,
      "resourceTransferSize": 302250,
      "lcp": null,
      "cls": null,
      "vitalsSettled": null,
      "console": [],
      "network": []
    },
    {
      "url": "https://example.com/",
      "redirectedFrom": [],
      "viewport": "375x812",
      "status": 200,
      "visits": 1,
      "loadTime": 386,
      "domContentLoaded": 49,
      "ttfb": 15,
      "transferSize": 41326,
      "resourceTransferSize": 113656,
      "lcp": null,
      "cls": null,
      "vitalsSettled": null,
      "console": [],
      "network": []
    },
    {
      "url": "https://example.com/videos/",
      "redirectedFrom": [],
      "viewport": "375x812",
      "status": 200,
      "visits": 1,
      "loadTime": 140,
      "domContentLoaded": 61,
      "ttfb": 16,
      "transferSize": 27665,
      "resourceTransferSize": 23788,
      "lcp": null,
      "cls": null,
      "vitalsSettled": null,
      "console": [],
      "network": []
    },
    {
      "url": "https://example.com/donate/",
      "redirectedFrom": [],
      "viewport": "375x812",
      "status": 200,
      "visits": 1,
      "loadTime": 132,
      "domContentLoaded": 49,
      "ttfb": 15,
      "transferSize": 26607,
      "resourceTransferSize": 0,
      "lcp": null,
      "cls": null,
      "vitalsSettled": null,
      "console": [],
      "network": []
    }
  ]
}
